Query,ReleventDoc1,RScore1,ReleventDoc2,RScore2,ReleventDoc3,RScore3,NonReleventDoc1,NRScore1,NonReleventDoc2,NRScore2,NonReleventDoc3,NRScore3What is bodily injury liability coverage?,Term-Bodily-Injury-Liability-Coverage,100,Term-Bodily-Injury,90,NA,80,Term-Comprehensive-Physical-Damage-Coverage,0,Term-Emergency-Road-Service-Coverage,0,NA,0Can you explain emergency road service coverage?,Term-Emergency-Road-Service-Coverage,100,NA,90,NA,80,Term-Bodily-Injury-Liability-Coverage,0,Term-Comprehensive-Physical-Damage-Coverage,0,NA,0What is the Vehicle Identification Number or VIN,Term-Vehicle-Identification-Number-VIN,100,NA,90,NA,80,Term-Comprehensive-Physical-Damage-Coverage,0,Term-Emergency-Road-Service-Coverage,0,NA,0Please define uninsured motorist coverage,Term-Uninsured-Motorist-Coverage,100,NA,90,NA,80,Term-Comprehensive-Physical-Damage-Coverage,0,Term-Emergency-Road-Service-Coverage,0,NA,0What is Comprehensive Physical Damage Coverage,Term-Comprehensive-Physical-Damage-Coverage,100,NA,90,NA,80,Term-Bodily-Injury-Liability-Coverage,0,Term-Emergency-Road-Service-Coverage,0,NA,0Please explain Collision Coverage ,Term-Collision-Coverage,100,NA,90,NA,80,Term-Bodily-Injury-Liability-Coverage,0,Term-Emergency-Road-Service-Coverage,0,NA,0